tweet_id,cleaned_text,location
ID_906307402529742848,St Martins famous airport badly damage Hurricane Irma,
ID_906513539401175040,island destroy Irma brace impact Hurricane Jose,
ID_906645137203367936,  oh God 85 St Marten totally destroy,
ID_906871868522680320,head MiamiDade hour dicey strong wind come Keys shelter Irma,
ID_907262817497227264,Irma damage bring tally Harvey 300B AccuWeather,
ID_907355309177532416,Kenny Chesneys St John residence destroy Irma simply go,
ID_907492875092365312,NorwegianSky deploy St Thomas assist humanitarian effort coordinate local gov Irma update,
ID_907744081044017152,low fuel light turn exit ramp FLL airport close damage boat marnia east FLL flwx hurricaneirma2017,
ID_907934034252095488,think ve see damage hard widespread place like USVirginIslands HurricaneIrma,
ID_908045879277473792,MiamiFL foster food need 4 dog leave tie poll fence tag collar doubt claim owner,
ID_908114652898324480,Hurricane Irma force Anna Maria Island resident evacuate time assess damage,
ID_908320341612748800,    good need water power food gas area Crystal Rivers start flood supply,
ID_908393066268110848,Huntsville leader stay ahead future flash flood floodway stay informed,
ID_908439719364657152,MiamiDade public school host food distribution event Hurricane Irma,
ID_908463698749960192,  m happy hear earthquake level village injure kill Prayers neighbor America,
ID_908526969456779264,Prime Osborn open door people need relief aftermath HurricaneIrma,
ID_908721429801250816,time work help community affect Irma assist St James Christian Academy cleanup morning itsnotaboutus,
ID_908815606102798336,Irma leave trail damage Apopka   mandatory evacuation order mandatory evacuation close,
ID_908925545370578944,Irma Barbudas 300yearold civilization extinguish    RO Water Filter,
ID_909386454111068160,way help victim Harvey Irma 5 tip disaster relief donation dollar,
ID_909419763306303488,donate 1000 100   help feed need SouthFlorida   IrmaRecovery,
ID_909420203947180032,RT   Hurricane Jose amble coast new Tropical Storm Maria track Irmas early path  ,
ID_909430097664409600,RT   temporary housing open Immokalee displace Hurricane Irma  ,
ID_909455122094280704,RT    Alico Arena serve shelter Hurricane Irma evacuee,
ID_909503639580037120,HurricaneIrma recovery effort continue Base housing RV park close Families ask stay away long diem,
ID_909541990127345664,UPDATE   relief supply hand 2 local official TheBahamas distribution 2 family affect HurricaneIrma,
ID_910708769247686656,Brigada de Rescate Topos Los Topos found 1985 MX earthquake   train collapse building rescue survivor,
ID_911974830479757312,team fromE12DA8F5 work site ruin sixstory building collapse Condesa MexicoEarthquake FuerzaMexico,
ID_912095234338754560,RT   remember radar go pr Maria move actual damage look like good htt,
ID_912179849707503616,Loiza town ravage Hurricane Irma 90 percent home   3000   destroy Maria,
ID_912183268577071104,hurricanemaria QUESTELL FAMILY miss 5 day PONCE help find,
ID_912376284365369344,RT   MexicoEarthquake Relief need Atlixco hmrd,
ID_914896320233709568,video   help people pr prepare 50 truckload water transport JAXPORT w come HurricaneMaria PRStrong,
ID_914963388840767488,Customs Border Protection continue support massive response effort follow HurricaneMaria NEWSROOM,
ID_914988875390619648,COOL PHOTO show   disaster team leader Tim Dominca port observe   airlift aid 4 HurricaneMaria response,
